<?xml version="1.0" encoding="UTF-8"?>
<tns:root xmlns:tns="http://www.example.org/EmployeeDetails" xmlns:xsi="http://www.w3.org/2001/XMLSchema-instance" xsi:schemaLocation="http://www.example.org/EmployeeDetails EmployeeDetails.xsd ">
  <tns:iSteer>
    <tns:empid>1234</tns:empid>
    <tns:ename>Sanjay</tns:ename>
    <tns:deptno>10</tns:deptno>
    <tns:sal>25000.0</tns:sal>
    <tns:job>thingsteer</tns:job>
  </tns:iSteer>
  <tns:iSteer>
    <tns:empid>1235</tns:empid>
    <tns:ename>tns:ename</tns:ename>
    <tns:deptno>0</tns:deptno>
    <tns:sal>0.0</tns:sal>
    <tns:job>tns:job</tns:job>
  </tns:iSteer>
  <tns:iSteer>
    <tns:empid>1236</tns:empid>
    <tns:ename>tns:ename</tns:ename>
    <tns:deptno>0</tns:deptno>
    <tns:sal>0.0</tns:sal>
    <tns:job>tns:job</tns:job>
  </tns:iSteer>
  <tns:iSteer>
    <tns:empid>1237</tns:empid>
    <tns:ename>tns:ename</tns:ename>
    <tns:deptno>0</tns:deptno>
    <tns:sal>0.0</tns:sal>
    <tns:job>tns:job</tns:job>
  </tns:iSteer>
  <tns:iSteer>
    <tns:empid>1238</tns:empid>
    <tns:ename>tns:ename</tns:ename>
    <tns:deptno>0</tns:deptno>
    <tns:sal>0.0</tns:sal>
    <tns:job>tns:job</tns:job>
  </tns:iSteer>
</tns:root>
